{
  "meta": {
    "schema_version": "2.0.0",
    "generated_at": "2026-03-19T18:22:26.562451Z",
    "segment_minutes": 1,
    "snapshot_count": 25
  },
  "metrics": {
    "time_series": [
      {
        "segment_start": "2026-02-26T10:40:00Z",
        "segment_end": "2026-02-26T10:41:00Z",
        "sample_count": 1,
        "values": {
          "speech_rate_wpm": 147.761,
          "articulation_rate_wpm": 158.258,
          "phonation_to_time_ratio": 0.7889,
          "mean_pause_duration_sec": 0.538,
          "f0_mean_hz": 197.4113,
          "jitter_local": 0.02024,
          "shimmer_local_db": 1.032866,
          "emotion_score": 0.083333,
          "self_pronoun_ratio": 0.08333333333333333,
          "type_token_ratio": 0.8611111111111112
        }
      },
      {
        "segment_start": "2026-02-27T14:05:00Z",
        "segment_end": "2026-02-27T14:06:00Z",
        "sample_count": 1,
        "values": {
          "speech_rate_wpm": 146.609,
          "articulation_rate_wpm": 161.961,
          "phonation_to_time_ratio": 0.7937,
          "mean_pause_duration_sec": 0.589,
          "f0_mean_hz": 192.5778,
          "jitter_local": 0.02341,
          "shimmer_local_db": 0.92665,
          "emotion_score": 0.0,
          "self_pronoun_ratio": 0.10526315789473684,
          "type_token_ratio": 0.868421052631579
        }
      },
      {
        "segment_start": "2026-02-28T09:00:00Z",
        "segment_end": "2026-02-28T09:01:00Z",
        "sample_count": 1,
        "values": {
          "speech_rate_wpm": 151.381,
          "articulation_rate_wpm": 166.419,
          "phonation_to_time_ratio": 0.7764,
          "mean_pause_duration_sec": 0.554,
          "f0_mean_hz": 198.3146,
          "jitter_local": 0.022612,
          "shimmer_local_db": 0.995026,
          "emotion_score": 0.243243,
          "self_pronoun_ratio": 0.05405405405405406,
          "type_token_ratio": 0.972972972972973
        }
      },
      {
        "segment_start": "2026-03-01T11:22:00Z",
        "segment_end": "2026-03-01T11:23:00Z",
        "sample_count": 1,
        "values": {
          "speech_rate_wpm": 151.41,
          "articulation_rate_wpm": 154.427,
          "phonation_to_time_ratio": 0.7014,
          "mean_pause_duration_sec": 0.49,
          "f0_mean_hz": 190.6735,
          "jitter_local": 0.026628,
          "shimmer_local_db": 1.103141,
          "emotion_score": 0.0,
          "self_pronoun_ratio": 0.1111111111111111,
          "type_token_ratio": 0.9444444444444444
        }
      },
      {
        "segment_start": "2026-03-02T15:55:00Z",
        "segment_end": "2026-03-02T15:56:00Z",
        "sample_count": 1,
        "values": {
          "speech_rate_wpm": 148.808,
          "articulation_rate_wpm": 163.775,
          "phonation_to_time_ratio": 0.7527,
          "mean_pause_duration_sec": 0.447,
          "f0_mean_hz": 213.6628,
          "jitter_local": 0.023453,
          "shimmer_local_db": 1.102286,
          "emotion_score": 0.0,
          "self_pronoun_ratio": 0.09375,
          "type_token_ratio": 0.84375
        }
      },
      {
        "segment_start": "2026-03-03T10:29:00Z",
        "segment_end": "2026-03-03T10:30:00Z",
        "sample_count": 1,
        "values": {
          "speech_rate_wpm": 144.189,
          "articulation_rate_wpm": 165.61,
          "phonation_to_time_ratio": 0.786,
          "mean_pause_duration_sec": 0.558,
          "f0_mean_hz": 208.6575,
          "jitter_local": 0.02232,
          "shimmer_local_db": 1.012062,
          "emotion_score": 0.0,
          "self_pronoun_ratio": 0.030303030303030304,
          "type_token_ratio": 0.9090909090909091
        }
      },
      {
        "segment_start": "2026-03-04T09:46:00Z",
        "segment_end": "2026-03-04T09:47:00Z",
        "sample_count": 1,
        "values": {
          "speech_rate_wpm": 143.374,
          "articulation_rate_wpm": 162.932,
          "phonation_to_time_ratio": 0.8209,
          "mean_pause_duration_sec": 0.486,
          "f0_mean_hz": 199.3441,
          "jitter_local": 0.026608,
          "shimmer_local_db": 1.053117,
          "emotion_score": -0.09375,
          "self_pronoun_ratio": 0.09375,
          "type_token_ratio": 0.96875
        }
      },
      {
        "segment_start": "2026-03-05T16:52:00Z",
        "segment_end": "2026-03-05T16:53:00Z",
        "sample_count": 1,
        "values": {
          "speech_rate_wpm": 146.106,
          "articulation_rate_wpm": 165.618,
          "phonation_to_time_ratio": 0.7974,
          "mean_pause_duration_sec": 0.636,
          "f0_mean_hz": 202.9597,
          "jitter_local": 0.022172,
          "shimmer_local_db": 1.005056,
          "emotion_score": 0.0,
          "self_pronoun_ratio": 0.05714285714285714,
          "type_token_ratio": 0.8571428571428571
        }
      },
      {
        "segment_start": "2026-03-06T11:58:00Z",
        "segment_end": "2026-03-06T11:59:00Z",
        "sample_count": 1,
        "values": {
          "speech_rate_wpm": 150.051,
          "articulation_rate_wpm": 164.144,
          "phonation_to_time_ratio": 0.7788,
          "mean_pause_duration_sec": 0.458,
          "f0_mean_hz": 197.8412,
          "jitter_local": 0.020827,
          "shimmer_local_db": 0.984364,
          "emotion_score": 0.081081,
          "self_pronoun_ratio": 0.10810810810810811,
          "type_token_ratio": 0.918918918918919
        }
      },
      {
        "segment_start": "2026-03-07T14:08:00Z",
        "segment_end": "2026-03-07T14:09:00Z",
        "sample_count": 1,
        "values": {
          "speech_rate_wpm": 149.568,
          "articulation_rate_wpm": 162.84,
          "phonation_to_time_ratio": 0.8125,
          "mean_pause_duration_sec": 0.565,
          "f0_mean_hz": 200.1895,
          "jitter_local": 0.020967,
          "shimmer_local_db": 1.122271,
          "emotion_score": 0.096774,
          "self_pronoun_ratio": 0.06451612903225806,
          "type_token_ratio": 0.9354838709677419
        }
      },
      {
        "segment_start": "2026-03-08T10:29:00Z",
        "segment_end": "2026-03-08T10:30:00Z",
        "sample_count": 1,
        "values": {
          "speech_rate_wpm": 159.719,
          "articulation_rate_wpm": 160.206,
          "phonation_to_time_ratio": 0.8278,
          "mean_pause_duration_sec": 0.526,
          "f0_mean_hz": 193.8698,
          "jitter_local": 0.020615,
          "shimmer_local_db": 1.037918,
          "emotion_score": -0.078947,
          "self_pronoun_ratio": 0.05263157894736842,
          "type_token_ratio": 0.8421052631578947
        }
      },
      {
        "segment_start": "2026-03-09T09:07:00Z",
        "segment_end": "2026-03-09T09:08:00Z",
        "sample_count": 1,
        "values": {
          "speech_rate_wpm": 148.264,
          "articulation_rate_wpm": 162.338,
          "phonation_to_time_ratio": 0.7717,
          "mean_pause_duration_sec": 0.441,
          "f0_mean_hz": 211.3435,
          "jitter_local": 0.023107,
          "shimmer_local_db": 1.012095,
          "emotion_score": 0.214286,
          "self_pronoun_ratio": 0.03571428571428571,
          "type_token_ratio": 1.0
        }
      },
      {
        "segment_start": "2026-03-10T15:40:00Z",
        "segment_end": "2026-03-10T15:41:00Z",
        "sample_count": 1,
        "values": {
          "speech_rate_wpm": 142.717,
          "articulation_rate_wpm": 156.749,
          "phonation_to_time_ratio": 0.8092,
          "mean_pause_duration_sec": 0.589,
          "f0_mean_hz": 184.5302,
          "jitter_local": 0.022724,
          "shimmer_local_db": 1.047343,
          "emotion_score": 0.0,
          "self_pronoun_ratio": 0.09375,
          "type_token_ratio": 0.9375
        }
      },
      {
        "segment_start": "2026-03-11T10:20:00Z",
        "segment_end": "2026-03-11T10:21:00Z",
        "sample_count": 1,
        "values": {
          "speech_rate_wpm": 152.348,
          "articulation_rate_wpm": 165.07,
          "phonation_to_time_ratio": 0.8342,
          "mean_pause_duration_sec": 0.512,
          "f0_mean_hz": 198.3933,
          "jitter_local": 0.026222,
          "shimmer_local_db": 1.020455,
          "emotion_score": -0.342857,
          "self_pronoun_ratio": 0.0,
          "type_token_ratio": 0.9142857142857143
        }
      },
      {
        "segment_start": "2026-03-12T14:46:00Z",
        "segment_end": "2026-03-12T14:47:00Z",
        "sample_count": 1,
        "values": {
          "speech_rate_wpm": 153.871,
          "articulation_rate_wpm": 163.132,
          "phonation_to_time_ratio": 0.7738,
          "mean_pause_duration_sec": 0.523,
          "f0_mean_hz": 186.2821,
          "jitter_local": 0.026086,
          "shimmer_local_db": 1.087164,
          "emotion_score": 0.085714,
          "self_pronoun_ratio": 0.02857142857142857,
          "type_token_ratio": 0.9428571428571428
        }
      },
      {
        "segment_start": "2026-03-13T10:27:00Z",
        "segment_end": "2026-03-13T10:28:00Z",
        "sample_count": 1,
        "values": {
          "speech_rate_wpm": 141.644,
          "articulation_rate_wpm": 149.493,
          "phonation_to_time_ratio": 0.7574,
          "mean_pause_duration_sec": 0.529,
          "f0_mean_hz": 190.8805,
          "jitter_local": 0.024443,
          "shimmer_local_db": 1.225806,
          "emotion_score": -0.090909,
          "self_pronoun_ratio": 0.09090909090909091,
          "type_token_ratio": 0.9696969696969697
        }
      },
      {
        "segment_start": "2026-03-14T09:15:00Z",
        "segment_end": "2026-03-14T09:16:00Z",
        "sample_count": 1,
        "values": {
          "speech_rate_wpm": 133.808,
          "articulation_rate_wpm": 160.377,
          "phonation_to_time_ratio": 0.7592,
          "mean_pause_duration_sec": 0.643,
          "f0_mean_hz": 202.9951,
          "jitter_local": 0.030328,
          "shimmer_local_db": 1.230421,
          "emotion_score": 0.0,